{
  "project":{"name":"BalanceBot Arduino","version":"2.0"},
  "components":[
    {"id":"arduino_1","type":"arduino_uno","position":{"x":120,"y":205},"rotation":0},
    {"id":"mpu_1","type":"mpu6050","position":{"x":430,"y":110},"rotation":0},
    {"id":"driver_1","type":"l298n","position":{"x":410,"y":350},"rotation":0},
    {"id":"motor_l","type":"dc_motor","position":{"x":100,"y":530},"rotation":0},
    {"id":"motor_r","type":"dc_motor","position":{"x":710,"y":530},"rotation":0},
    {"id":"battery_1","type":"battery_switch","position":{"x":540,"y":565},"rotation":0}
  ],
  "wires":[
    {"from":"arduino_1.A4","to":"mpu_1.SDA","label":"I2C","signal":"i2c","color":"i2c"},
    {"from":"arduino_1.A5","to":"mpu_1.SCL","label":"I2C","signal":"i2c","color":"i2c"},
    {"from":"arduino_1.5V","to":"mpu_1.VCC","label":"5V → VCC","signal":"power","color":"power"},
    {"from":"arduino_1.GND","to":"mpu_1.GND","label":"GND مشترك","signal":"ground","color":"ground"},
    {"from":"arduino_1.D5","to":"driver_1.ENA","label":"PWM ENA","signal":"control","color":"control"},
    {"from":"driver_1.OUT1","to":"motor_l.M+","label":"OUT1","signal":"motor","color":"motor"},
    {"from":"driver_1.OUT2","to":"motor_l.M-","label":"OUT2","signal":"motor","color":"motor"},
    {"from":"battery_1.+","to":"driver_1.12V","label":"VMOTOR +","signal":"power","color":"power"},
    {"from":"battery_1.-","to":"driver_1.GND","label":"GND","signal":"ground","color":"ground"}
  ],
  "settings":{"showPinNumbers":true,"showLabels":true,"showElectricalWarnings":true,"grid":24}
}
